{
  "$schema": "http://json-schema.org/draft-07/schema#",
  "$id": "https://w-model-dev/schemas/rootcause-report.schema.json",
  "title": "RootCauseReport",
  "description": "根因分析报告结构 schema，对应 root-cause-logic.ts RootCauseReportShape（R 子代理产出）",
  "$comment": "r10-contract nodes are declared in the standard JSON Schema annotation below: {\"r10-contract\":[{\"id\":\"canonical-name\",\"relation\":{\"canonicalPersona\":\"testing-reality-checker\"},\"prose\":\"canonical persona is testing-reality-checker\"},{\"id\":\"threshold\",\"relation\":{\"canonicalPersona\":\"testing-reality-checker\",\"confidenceMinimum\":0.5},\"prose\":\"testing-reality-checker confidence >= 0.5\"},{\"id\":\"legacy-fallback\",\"relation\":{\"legacyPersona\":\"reality-checker\",\"fallbackWhen\":\"canonical-absent\"},\"prose\":\"legacy reality-checker is fallback only when canonical is absent\"},{\"id\":\"same-artifact-dedupe\",\"relation\":{\"artifactRelation\":\"same\",\"precedence\":\"canonical-first\",\"duplicateCount\":\"once\"},\"prose\":\"same artifact canonical-first and not counted twice\"},{\"id\":\"cross-artifact-conflict\",\"relation\":{\"artifactRelation\":\"different\",\"conflict\":\"fail-closed\"},\"prose\":\"different artifact conflict is fail-closed\"},{\"id\":\"canonical-duplicate\",\"relation\":{\"persona\":\"canonical\",\"duplicateThreshold\":1,\"duplicatePolicy\":\"fail-closed\"},\"prose\":\"canonical > 1 duplicate is fail-closed\"},{\"id\":\"legacy-duplicate\",\"relation\":{\"persona\":\"legacy\",\"duplicateThreshold\":1,\"duplicatePolicy\":\"fail-closed\"},\"prose\":\"legacy > 1 duplicate is fail-closed\"}]}",
  "type": "object",
  "additionalProperties": false,
  "required": [
    "schemaVersion",
    "meta",
    "input",
    "phenomenon",
    "upstreamDefect",
    "fixRecommendation",
    "prevention",
    "qualityLevel",
    "passed",
    "summary"
  ],
  "properties": {
    "schemaVersion": { "description": "报告 schema 版本号，固定 \"1.0\"", "type": "string", "pattern": "^1\\.0$" },
    "meta": {
      "description": "报告元信息（报告 ID / 目标 / 分析方法等，R1 完整性校验）",
      "type": "object",
      "additionalProperties": false,
      "required": [
        "reportId",
        "targetKind",
        "targetArtifact",
        "targetPhase",
        "reworkRound",
        "reworkSource",
        "persona",
        "method",
        "analysisTimestamp"
      ],
      "properties": {
        "reportId": {
          "description": "报告 ID（格式 RC-<阶段>-<轮次>-<序号>，如 RC-phase5-1-01；R8 校验格式 ^RC-[a-z0-9]+-\\d+-\\d+$）",
          "type": "string",
          "minLength": 1
        },
        "targetKind": { "description": "报告类型，固定 \"rootcause\"（R1 校验）", "const": "rootcause" },
        "targetArtifact": {
          "description": "被分析的目标产物路径或 ID（如 .w-model/rtm.json）",
          "type": "string",
          "minLength": 1
        },
        "targetPhase": { "description": "目标阶段（如 阶段 5 - 编码，对应样本值）", "type": "string", "minLength": 1 },
        "reworkRound": { "description": "返工轮次（从 1 起，≥1 整数）", "type": "integer", "minimum": 1 },
        "reworkSource": {
          "description": "触发返工来源：verifier=V 评审失败 / gate=门禁失败",
          "enum": ["verifier", "gate"]
        },
        "persona": {
          "description": "执行分析的角色切片标识（如 root-cause-locator）",
          "type": "string",
          "minLength": 1
        },
        "method": {
          "description": "根因分析方法枚举：5-why=连续追问 / fishbone=鱼骨图 / defect-chain=缺陷链 / upstream-trace=上游追溯 / combined=多角度组合（R9：combined 须带 partialReports）",
          "enum": ["5-why", "fishbone", "defect-chain", "upstream-trace", "combined"]
        },
        "analysisTimestamp": {
          "description": "分析时间（ISO 8601 date-time）",
          "type": "string",
          "format": "date-time"
        }
      }
    },
    "input": {
      "description": "触发输入（返工提示与来源文件路径）",
      "type": "object",
      "additionalProperties": false,
      "required": ["reworkHints"],
      "properties": {
        "reworkHints": {
          "description": "触发返工的提示数组（非空，≥1 条；来自 V 评审或门禁失败信息）",
          "type": "array",
          "minItems": 1,
          "items": { "type": "string" }
        },
        "verifierOutputPath": { "description": "V 评审输出文件路径（reworkSource=verifier 时提供）", "type": "string" },
        "gateJsonPath": { "description": "门禁 GATE_JSON 存档路径（reworkSource=gate 时提供）", "type": "string" }
      }
    },
    "phenomenon": {
      "description": "现象描述（问题症状与影响面）",
      "type": "object",
      "additionalProperties": false,
      "required": ["summary", "severity", "affectedArtifacts"],
      "properties": {
        "summary": { "description": "现象摘要（非空字符串）", "type": "string", "minLength": 1 },
        "severity": {
          "description": "严重级别：Critical=致命 / Required=必须修复 / Optional=可选修复 / Nit=琐碎 / FYI=仅告知",
          "enum": ["Critical", "Required", "Optional", "Nit", "FYI"]
        },
        "affectedArtifacts": {
          "description": "受影响产物路径数组（非空，≥1 条）",
          "type": "array",
          "minItems": 1,
          "items": { "type": "string" }
        }
      }
    },
    "noRootCause": {
      "description": "系统化调查完成后确无可归根因时的合法出口；仅限 environmental / timing / external，且调查记录与缓解措施缺一不可",
      "type": "object",
      "additionalProperties": false,
      "required": ["kind", "investigation", "mitigation"],
      "properties": {
        "kind": {
          "description": "无根因现象形态：environmental=环境型 / timing=时序型 / external=外部依赖型",
          "enum": ["environmental", "timing", "external"]
        },
        "investigation": {
          "description": "已完成的调查过程、排除项与逐步证据；必须非空，禁止用未调查的“没找到”代替",
          "type": "string",
          "minLength": 1
        },
        "mitigation": {
          "description": "已确定的缓解与可观测性措施，如重试、超时、明确错误提示、监控或日志",
          "type": "string",
          "minLength": 1
        }
      }
    },
    "rootCauseChain": {
      "description": "常规根因分支的根因分析链数组（5-why 等逐层追问；R2 校验长度 [2,5] 且每环 evidence 非空）；仅 noRootCause 合法分支条件豁免",
      "type": "array",
      "minItems": 2,
      "maxItems": 5,
      "items": {
        "description": "根因链单环节（RootCauseStep：step + why + answer + evidence）",
        "type": "object",
        "additionalProperties": false,
        "required": ["step", "why", "answer", "evidence"],
        "properties": {
          "step": { "description": "链步骤序号（从 1 起递增）", "type": "integer", "minimum": 1 },
          "why": { "description": "「为什么」追问问题（非空）", "type": "string", "minLength": 1 },
          "answer": { "description": "对「为什么」的回答（非空）", "type": "string", "minLength": 1 },
          "evidence": {
            "description": "本环节的证据引用（R2 校验非空；具体产物/日志/代码位置）",
            "type": "string",
            "minLength": 1
          }
        }
      }
    },
    "rootCause": {
      "description": "常规根因分支的根因结论（分类 + 描述 + 证据 + 可证伪检查）；仅 noRootCause 合法分支条件豁免",
      "type": "object",
      "additionalProperties": false,
      "required": ["category", "description", "evidence", "falsifiabilityCheck"],
      "properties": {
        "category": {
          "description": "根因分类（7 类）：requirement-gap=需求缺口 / design-flaw=设计缺陷 / coding-error=编码错误 / test-gap=测试缺口 / process-missing=流程缺失 / tool-gap=工具缺口 / upstream-defect=上游缺陷",
          "enum": [
            "requirement-gap",
            "design-flaw",
            "coding-error",
            "test-gap",
            "process-missing",
            "tool-gap",
            "upstream-defect"
          ]
        },
        "description": { "description": "根因描述（非空）", "type": "string", "minLength": 1 },
        "evidence": { "description": "根因证据引用（非空；产物/日志/代码位置）", "type": "string", "minLength": 1 },
        "falsifiabilityCheck": {
          "description": "可证伪性检查（须含「若…则」句式，R3 校验可证伪假设）",
          "type": "string",
          "minLength": 1
        }
      }
    },
    "upstreamDefect": {
      "description": "上游缺陷标记（present=true 时须补齐上游信息，R6 校验）",
      "type": "object",
      "additionalProperties": false,
      "required": ["present", "rollbackRecommended"],
      "properties": {
        "present": {
          "description": "是否检测到上游缺陷（boolean；true 时触发阶段回退升级与 R6 校验）",
          "type": "boolean"
        },
        "upstreamPhase": { "description": "上游缺陷所在阶段（present=true 时必填且非空，R6）", "type": "string" },
        "upstreamArtifactId": { "description": "上游缺陷产物 ID（present=true 时必填且非空，R6）", "type": "string" },
        "defectDescription": { "description": "上游缺陷描述（present=true 时必填且非空，R6）", "type": "string" },
        "rollbackRecommended": { "description": "是否建议阶段回退（boolean）", "type": "boolean" }
      }
    },
    "fixRecommendation": {
      "description": "修复建议列表（R4 校验非空且每项 target/location/action/rationale 四字段 + scope 合规）",
      "type": "array",
      "minItems": 1,
      "items": {
        "description": "单条修复建议（target + location + action + rationale + scope）",
        "type": "object",
        "additionalProperties": false,
        "required": ["target", "location", "action", "rationale", "scope"],
        "properties": {
          "target": { "description": "修复目标（产物/模块/流程环节）", "type": "string", "minLength": 1 },
          "location": { "description": "修复位置（文件路径/行号/节点 ID）", "type": "string", "minLength": 1 },
          "action": { "description": "修复动作描述（做什么、怎么做）", "type": "string", "minLength": 1 },
          "rationale": { "description": "修复理由（为何如此修）", "type": "string", "minLength": 1 },
          "scope": {
            "type": "object",
            "additionalProperties": false,
            "required": ["allowed", "forbidden"],
            "properties": {
              "allowed": { "type": "array", "items": { "type": "string", "minLength": 1 } },
              "forbidden": { "type": "array", "items": { "type": "string", "minLength": 1 } }
            },
            "description": "修复范围声明：allowed=允许触碰面，forbidden=禁改面（测试/语义/证据）。R4 强制：至少一侧非空。V scoped re-review 对照消费"
          }
        }
      }
    },
    "prevention": {
      "description": "预防措施列表（R5 校验非空且每项三字段齐全）",
      "type": "array",
      "minItems": 1,
      "items": {
        "description": "单条预防措施（scope + measure + owner，防根因复发）",
        "type": "object",
        "additionalProperties": false,
        "required": ["scope", "measure", "owner"],
        "properties": {
          "scope": { "description": "预防范围（流程 / 工具 / 测试 / 文档等）", "type": "string", "minLength": 1 },
          "measure": { "description": "预防措施描述", "type": "string", "minLength": 1 },
          "owner": { "description": "负责角色或人（如 G / V / 用户）", "type": "string", "minLength": 1 }
        }
      }
    },
    "qualityLevel": {
      "description": "报告质量等级：A/B/C/D（R7：A/B 须 passed=true，C/D 须 passed=false）",
      "enum": ["A", "B", "C", "D"]
    },
    "passed": { "description": "报告是否通过（R7 与 qualityLevel 一致：A/B→true，C/D→false）", "type": "boolean" },
    "summary": { "description": "报告摘要（非空，概括根因与处置建议）", "type": "string", "minLength": 1 },
    "reviewNotes": { "description": "评审备注（可选，V 复审意见补充）", "type": "string" },
    "partialReports": {
      "description": "多角度场景附录（method=combined 时 R9 校验非空；R10 canonical-first 校验含 personaSlice=testing-reality-checker 且 confidence ≥0.5；legacy reality-checker 仅在 canonical 缺失时作 fallback；同 artifact canonical-first 不重复计数；跨 artifact 冲突、canonical 重复、legacy 重复均 fail-closed，防幻想根因）。R10 结构化契约关系见根 schema 的标准 $comment 节点。",
      "type": "array",
      "items": {
        "description": "单份多角度并行产出的部分根因报告登记（personaSlice + path + confidence）",
        "type": "object",
        "additionalProperties": false,
        "required": ["personaSlice", "path", "confidence"],
        "properties": {
          "personaSlice": {
            "description": "角度切片标识；规范 reality checker 为 testing-reality-checker，legacy reality-checker 仅作兼容 fallback，不新增 alias 字段（R10）",
            "type": "string",
            "minLength": 1
          },
          "path": {
            "description": "局部报告文件路径；canonical+legacy 仅在指向同一 artifact 时视为同一语义",
            "type": "string",
            "minLength": 1
          },
          "confidence": {
            "description": "该角度结论置信度（0-1 小数）；canonical testing-reality-checker（或 legacy reality-checker fallback）须 ≥0.5，R10",
            "type": "number",
            "minimum": 0,
            "maximum": 1
          }
        }
      }
    }
  },
  "oneOf": [
    {
      "description": "常规 RootCauseReport：R2/R3 字段保持必填，且不得同时宣告 noRootCause",
      "required": ["rootCauseChain", "rootCause"],
      "properties": {
        "rootCauseChain": { "description": "常规分支必须存在根因链标识（实际结构由根 properties 约束）。" },
        "rootCause": { "description": "常规分支必须存在根因结论标识（实际结构由根 properties 约束）。" }
      },
      "not": {
        "description": "常规分支不得出现 noRootCause，防止以合法出口规避 R2/R3 根因链要求",
        "required": ["noRootCause"],
        "properties": {
          "noRootCause": { "description": "出现即触发 not 失败，常规分支禁止该字段。" }
        }
      }
    },
    {
      "description": "noRootCause 合法出口：完整出口证据替代常规根因链与可证伪根因结论",
      "required": ["noRootCause"],
      "properties": {
        "noRootCause": { "description": "合法出口必须存在 noRootCause 标识（实际结构由根 properties 约束）。" }
      },
      "not": {
        "description": "合法出口分支不得同时携带 rootCauseChain 或 rootCause，双分支互斥",
        "anyOf": [
          {
            "description": "出现 rootCauseChain 即触发 not 失败。",
            "required": ["rootCauseChain"],
            "properties": {
              "rootCauseChain": { "description": "出现即判定混用常规与合法出口分支。" }
            }
          },
          {
            "description": "出现 rootCause 即触发 not 失败。",
            "required": ["rootCause"],
            "properties": {
              "rootCause": { "description": "出现即判定混用常规与合法出口分支。" }
            }
          }
        ]
      }
    }
  ]
}
